{"action_schema":"lc-action/1","artifacts":[{"file":"checkpoints/step-850.onnx","format":"onnx","sha256":"6cf0387ec6cf9c1309b3db340d78a34c9ae3147786284fdec18fb2e5e7cfa7ec"},{"file":"checkpoints/step-850.pt","format":"pytorch","sha256":"2fd22bcfa95cf32b68752351988eadd10ff73447e1cbe40167de08850493e72c"}],"checkpoint_id":"step-850","format":"lc-checkpoint/1","metadata_sha256":"35a890bd767b5e2b0580ba126f74c677720d41d20732e45b47ec4568022a5cc2","model_architecture":{"config":{"height":12,"hidden_size":128,"width":12},"name":"mlp-hwc-flatten","version":"1"},"observation_schema":"lc-observation/1","onnx":{"file":"checkpoints/step-850.onnx","opset":17,"runtime":"onnxruntime-web","sha256":"6cf0387ec6cf9c1309b3db340d78a34c9ae3147786284fdec18fb2e5e7cfa7ec"},"pytorch":{"file":"checkpoints/step-850.pt","format":"state_dict+optimizer","sha256":"2fd22bcfa95cf32b68752351988eadd10ff73447e1cbe40167de08850493e72c"},"step":850}