{"action_schema":"lc-action/1","artifacts":[{"file":"checkpoints/step-0.onnx","format":"onnx","sha256":"f826174f317108c30977f26723c6036d87326d158bd159db79aeaf9062b03698"},{"file":"checkpoints/step-0.pt","format":"pytorch","sha256":"d9a88776eb629dbbe3fe2a7b5e85de7634dd036c725ff7fd6b05bb976afb5062"}],"checkpoint_id":"step-0","format":"lc-checkpoint/1","metadata_sha256":"b37e7a854b7201697a98030f569314176365ee456dbe25bd8b34643c25512364","model_architecture":{"config":{"height":12,"hidden_size":128,"width":12},"name":"mlp-hwc-flatten","version":"1"},"observation_schema":"lc-observation/1","onnx":{"file":"checkpoints/step-0.onnx","opset":17,"runtime":"onnxruntime-web","sha256":"f826174f317108c30977f26723c6036d87326d158bd159db79aeaf9062b03698"},"pytorch":{"file":"checkpoints/step-0.pt","format":"state_dict+optimizer","sha256":"d9a88776eb629dbbe3fe2a7b5e85de7634dd036c725ff7fd6b05bb976afb5062"},"step":0}