{"action_schema":"lc-action/1","artifacts":[{"file":"checkpoints/step-950.onnx","format":"onnx","sha256":"d08abcfe7fff852c8da261d085e60e29043fab2c30a32843a30efb5baa61d0b2"},{"file":"checkpoints/step-950.pt","format":"pytorch","sha256":"b66ab6d2e181663a2c66031fee3fc8d96f428c044617177404d8641441218e99"}],"checkpoint_id":"step-950","format":"lc-checkpoint/1","metadata_sha256":"e0bd5696fddeb7f5fb94ba59c77dca44f532dbce1096aa89eb9d42810e06506c","model_architecture":{"config":{"height":12,"hidden_size":128,"width":12},"name":"mlp-hwc-flatten","version":"1"},"observation_schema":"lc-observation/1","onnx":{"file":"checkpoints/step-950.onnx","opset":17,"runtime":"onnxruntime-web","sha256":"d08abcfe7fff852c8da261d085e60e29043fab2c30a32843a30efb5baa61d0b2"},"pytorch":{"file":"checkpoints/step-950.pt","format":"state_dict+optimizer","sha256":"b66ab6d2e181663a2c66031fee3fc8d96f428c044617177404d8641441218e99"},"step":950}