{"action_schema":"lc-action/1","artifacts":[{"file":"checkpoints/step-150.onnx","format":"onnx","sha256":"109c6ce7472c58858116b916434bca7864231cdaa9751a3f262b27e0719e1b00"},{"file":"checkpoints/step-150.pt","format":"pytorch","sha256":"ba28d29f82d3d826764bf8346e87df79e3fe1b8fa91f48fe18a5ade4918877d6"}],"checkpoint_id":"step-150","format":"lc-checkpoint/1","metadata_sha256":"8e547ad5bd818e36a66e5dbb9886a265c31bd6a8a69856b93f99c146f838d6aa","model_architecture":{"config":{"height":12,"hidden_size":128,"width":12},"name":"mlp-hwc-flatten","version":"1"},"observation_schema":"lc-observation/1","onnx":{"file":"checkpoints/step-150.onnx","opset":17,"runtime":"onnxruntime-web","sha256":"109c6ce7472c58858116b916434bca7864231cdaa9751a3f262b27e0719e1b00"},"pytorch":{"file":"checkpoints/step-150.pt","format":"state_dict+optimizer","sha256":"ba28d29f82d3d826764bf8346e87df79e3fe1b8fa91f48fe18a5ade4918877d6"},"step":150}