{"action_schema":"lc-action/1","artifacts":[{"file":"checkpoints/pv-train-dev-20261022-f2abc7d8-policy-value.onnx","format":"onnx","sha256":"831afb177dd9f1d68bef51a9ac02512d5c0f5744b601d8fd562c49769873ec8a"},{"file":"checkpoints/pv-train-dev-20261022-f2abc7d8-policy-value.pt","format":"pytorch","sha256":"5efe7353f58ede8e1d2881c1f29b45639f63b2075ddbfa827b7fd66cac1535f9"}],"checkpoint_id":"pv-train-dev-20261022-f2abc7d8-policy-value","format":"lc-checkpoint/1","metadata_sha256":"f493e92910b6b06aa377e0084747c560445437419d053ba40b0a4769fe6a4bfa","model_architecture":{"config":{"height":12,"hidden_size":128,"width":12},"name":"mlp-hwc-flatten","version":"2"},"observation_schema":"lc-observation/1","onnx":{"file":"checkpoints/pv-train-dev-20261022-f2abc7d8-policy-value.onnx","opset":17,"runtime":"onnxruntime-web","sha256":"831afb177dd9f1d68bef51a9ac02512d5c0f5744b601d8fd562c49769873ec8a"},"pytorch":{"file":"checkpoints/pv-train-dev-20261022-f2abc7d8-policy-value.pt","format":"state_dict+optimizer","sha256":"5efe7353f58ede8e1d2881c1f29b45639f63b2075ddbfa827b7fd66cac1535f9"},"step":60}
