{"action_schema":"lc-action/1","artifacts":[{"file":"checkpoints/step-350.onnx","format":"onnx","sha256":"ae6f553b38de3b8d9a725e5001ed83ed40a18478915d772f729c75464d0b925a"},{"file":"checkpoints/step-350.pt","format":"pytorch","sha256":"768caa0561367c93277551bce6ff5cd7998bbe9724dd5a86a63ac853ac5432be"}],"checkpoint_id":"step-350","format":"lc-checkpoint/1","metadata_sha256":"df96777fb12c38df0473e002a5b9f1b235710c2e729cb9c3d43c224a62297043","model_architecture":{"config":{"height":12,"hidden_size":128,"width":12},"name":"mlp-hwc-flatten","version":"1"},"observation_schema":"lc-observation/1","onnx":{"file":"checkpoints/step-350.onnx","opset":17,"runtime":"onnxruntime-web","sha256":"ae6f553b38de3b8d9a725e5001ed83ed40a18478915d772f729c75464d0b925a"},"pytorch":{"file":"checkpoints/step-350.pt","format":"state_dict+optimizer","sha256":"768caa0561367c93277551bce6ff5cd7998bbe9724dd5a86a63ac853ac5432be"},"step":350}