{"action_schema":"lc-action/1","artifacts":[{"file":"checkpoints/step-400.onnx","format":"onnx","sha256":"e3e1f2183bd0ea15201c670316b5c22cc3962655f57770fc9636a3a937694077"},{"file":"checkpoints/step-400.pt","format":"pytorch","sha256":"bcb005372fa220fd593af903a7b93dcdeaf42f3c611abec2424d2ab93e59b628"}],"checkpoint_id":"step-400","format":"lc-checkpoint/1","metadata_sha256":"c469d7ea3522fd11378c6d77f6c3b0311d36e0afacf5ee64542ebcb0b14e7ab7","model_architecture":{"config":{"height":12,"hidden_size":128,"width":12},"name":"mlp-hwc-flatten","version":"1"},"observation_schema":"lc-observation/1","onnx":{"file":"checkpoints/step-400.onnx","opset":17,"runtime":"onnxruntime-web","sha256":"e3e1f2183bd0ea15201c670316b5c22cc3962655f57770fc9636a3a937694077"},"pytorch":{"file":"checkpoints/step-400.pt","format":"state_dict+optimizer","sha256":"bcb005372fa220fd593af903a7b93dcdeaf42f3c611abec2424d2ab93e59b628"},"step":400}