{"action_schema":"lc-action/1","artifacts":[{"file":"checkpoints/step-500.onnx","format":"onnx","sha256":"7d4110896d9ffed863011ac9a9c0aca519b8b4b862ef0ded4de57aa139a2316e"},{"file":"checkpoints/step-500.pt","format":"pytorch","sha256":"50e7464dbab3eb5fbcac976a148bc1ef95534a39ad52ed3ceb558c2899e413c2"}],"checkpoint_id":"step-500","format":"lc-checkpoint/1","metadata_sha256":"47e79c350a05e8080e3c7ab49af832eb4b795ffe28401953b4f65120345710fd","model_architecture":{"config":{"height":12,"hidden_size":128,"width":12},"name":"mlp-hwc-flatten","version":"1"},"observation_schema":"lc-observation/1","onnx":{"file":"checkpoints/step-500.onnx","opset":17,"runtime":"onnxruntime-web","sha256":"7d4110896d9ffed863011ac9a9c0aca519b8b4b862ef0ded4de57aa139a2316e"},"pytorch":{"file":"checkpoints/step-500.pt","format":"state_dict+optimizer","sha256":"50e7464dbab3eb5fbcac976a148bc1ef95534a39ad52ed3ceb558c2899e413c2"},"step":500}