{"action_schema":"lc-action/1","artifacts":[{"file":"checkpoints/step-0.onnx","format":"onnx","sha256":"6b5185c07e483bf8a203ea97ed74be7f124e93a1f0a1547bda44d052ef6aab2a"},{"file":"checkpoints/step-0.pt","format":"pytorch","sha256":"5e3eedc1d9cd8e805e01c17dab94b8d7ac464f5bfe4bd8fe770b7a90fde34a06"}],"checkpoint_id":"step-0","format":"lc-checkpoint/1","metadata_sha256":"115b0bc0f359fd4f85a5e2698a1f9a52c5adf52cf9f4a68763a1d441d1dab70c","model_architecture":{"config":{"height":12,"hidden_size":128,"width":12},"name":"mlp-hwc-flatten","version":"1"},"observation_schema":"lc-observation/1","onnx":{"file":"checkpoints/step-0.onnx","opset":17,"runtime":"onnxruntime-web","sha256":"6b5185c07e483bf8a203ea97ed74be7f124e93a1f0a1547bda44d052ef6aab2a"},"pytorch":{"file":"checkpoints/step-0.pt","format":"state_dict+optimizer","sha256":"5e3eedc1d9cd8e805e01c17dab94b8d7ac464f5bfe4bd8fe770b7a90fde34a06"},"step":0}