{"action_schema":"lc-action/1","artifacts":[{"file":"checkpoints/step-300.onnx","format":"onnx","sha256":"3fb953ac2597471f6c22898edacf6cb0bf44a729a43708f0acaf50066874f6c7"},{"file":"checkpoints/step-300.pt","format":"pytorch","sha256":"ddd7409a9db371f1a2cb12f011a361466bde7c22c24f6dfddfe35c7d008139e1"}],"checkpoint_id":"step-300","format":"lc-checkpoint/1","metadata_sha256":"1507f39ca13b5b2540c61a47fe0dfe50b0579348cceb1542f56830b7766887fa","model_architecture":{"config":{"height":12,"hidden_size":128,"width":12},"name":"mlp-hwc-flatten","version":"1"},"observation_schema":"lc-observation/1","onnx":{"file":"checkpoints/step-300.onnx","opset":17,"runtime":"onnxruntime-web","sha256":"3fb953ac2597471f6c22898edacf6cb0bf44a729a43708f0acaf50066874f6c7"},"pytorch":{"file":"checkpoints/step-300.pt","format":"state_dict+optimizer","sha256":"ddd7409a9db371f1a2cb12f011a361466bde7c22c24f6dfddfe35c7d008139e1"},"step":300}