{"action_schema":"lc-action/1","artifacts":[{"file":"checkpoints/step-700.onnx","format":"onnx","sha256":"d4e94a98e26a35f1174f677c5fff4ae7b812d606100fea7a89dc4ae255505be3"},{"file":"checkpoints/step-700.pt","format":"pytorch","sha256":"af92ccbd7ff0db7a202ae11ecf5327ec1986155897fda1a9f02b0c2e446f2e90"}],"checkpoint_id":"step-700","format":"lc-checkpoint/1","metadata_sha256":"453430a8e008ae40fe3fac675290b721f5e9d3ab75abebfa51f498d0f394b4e0","model_architecture":{"config":{"height":12,"hidden_size":128,"width":12},"name":"mlp-hwc-flatten","version":"1"},"observation_schema":"lc-observation/1","onnx":{"file":"checkpoints/step-700.onnx","opset":17,"runtime":"onnxruntime-web","sha256":"d4e94a98e26a35f1174f677c5fff4ae7b812d606100fea7a89dc4ae255505be3"},"pytorch":{"file":"checkpoints/step-700.pt","format":"state_dict+optimizer","sha256":"af92ccbd7ff0db7a202ae11ecf5327ec1986155897fda1a9f02b0c2e446f2e90"},"step":700}